{
  "$id": "ELIEUVwNAk1z-_jJJ9BuUtQw-c3TY-RvcQyYw5dI4_JK",
  "$schema": "https://json-schema.org/draft/2020-12/schema",
  "title": "AI coder license",
  "description": "Certify that a software developer has the training and experience to use AI tools safely while writing code.",
  "type": "object",
  "credentialType": "ai-coder",
  "version": "2.0.0",
  "required": [
    "v",
    "d",
    "i",
    "rd",
    "s",
    "a",
    "r"
  ],
  "properties": {
    "v": {
      "description": "ACDC version string",
      "type": "string"
    },
    "t": {
      "description": "Message type. Optional; an ACDC JSON message without it is of type acm.",
      "type": "string"
    },
    "d": {
      "description": "SAID of this credential",
      "type": "string",
      "pattern": "^(?:[BE][A-Za-z0-9_-]{43}|0[DEFG][A-Za-z0-9_-]{86})$"
    },
    "u": {
      "description": "Salty nonce that blinds this credential's SAID. Optional; ordinarily wanted, since the attribute block names a person.",
      "type": "string"
    },
    "i": {
      "description": "AID of the issuer granting the license",
      "type": "string",
      "pattern": "^(?:[BE][A-Za-z0-9_-]{43}|0[DEFG][A-Za-z0-9_-]{86})$"
    },
    "rd": {
      "description": "SAID of the registry whose TEL carries this credential's issuance and revocation. Required: a license the issuer cannot revoke confers privileges it can no longer stand behind.",
      "type": "string",
      "pattern": "^(?:[BE][A-Za-z0-9_-]{43}|0[DEFG][A-Za-z0-9_-]{86})$"
    },
    "s": {
      "description": "SAID of this schema",
      "type": "string",
      "pattern": "^(?:[BE][A-Za-z0-9_-]{43}|0[DEFG][A-Za-z0-9_-]{86})$"
    },
    "a": {
      "oneOf": [
        {
          "description": "Attributes block SAID (compact form)",
          "type": "string",
          "pattern": "^(?:[BE][A-Za-z0-9_-]{43}|0[DEFG][A-Za-z0-9_-]{86})$"
        },
        {
          "description": "Attributes detail",
          "type": "object",
          "required": [
            "u",
            "i",
            "dt",
            "validFrom",
            "issuerName"
          ],
          "properties": {
            "d": {
              "description": "SAID of this attributes block",
              "type": "string",
              "pattern": "^(?:[BE][A-Za-z0-9_-]{43}|0[DEFG][A-Za-z0-9_-]{86})$"
            },
            "u": {
              "description": "Salty nonce that blinds this block. Required: the block names a person, and an unblinded block lets anyone watching the registry confirm a guess about who was licensed.",
              "type": "string"
            },
            "i": {
              "description": "Issuee: the AID of the licensed developer",
              "type": "string",
              "pattern": "^(?:[BE][A-Za-z0-9_-]{43}|0[DEFG][A-Za-z0-9_-]{86})$"
            },
            "dt": {
              "description": "When the license was issued, as an ISO-8601 datetime",
              "type": "string",
              "format": "date-time",
              "examples": [
                "2026-09-15T14:23:16+00:00"
              ]
            },
            "validFrom": {
              "description": "When the license begins conferring privileges, as an ISO-8601 datetime. May be before or after issuance.",
              "type": "string",
              "format": "date-time",
              "examples": [
                "2026-09-15T14:23:16+00:00"
              ]
            },
            "validUntil": {
              "description": "When the license stops conferring privileges, as an ISO-8601 datetime. After it the issuer stops managing revocation. Absent means the issuer set no horizon.",
              "type": "string",
              "format": "date-time",
              "examples": [
                "2027-09-15T14:23:16+00:00"
              ]
            },
            "issuerName": {
              "description": "Self-asserted name of the issuer, for human readers. Carries no verification weight; the issuer is its AID.",
              "type": "string",
              "examples": [
                "Acme AI Certification Authority"
              ]
            },
            "issueeName": {
              "description": "Name of the issuee as asserted by the issuer, for human readers. Carries no verification weight; the issuee is its AID.",
              "type": "string",
              "examples": [
                "Alice Example"
              ]
            }
          },
          "additionalProperties": false
        }
      ]
    },
    "e": {
      "oneOf": [
        {
          "description": "Edges block SAID (compact form)",
          "type": "string",
          "pattern": "^(?:[BE][A-Za-z0-9_-]{43}|0[DEFG][A-Za-z0-9_-]{86})$"
        },
        {
          "description": "Edges detail",
          "type": "object",
          "minProperties": 1,
          "properties": {
            "d": {
              "description": "SAID of this edges block. Optional for the reason @enr3eg made a.d optional: the fork's acdcmap emits no block SAID, so requiring one would reject every edge-bearing credential an issuer can actually build.",
              "type": "string",
              "pattern": "^(?:[BE][A-Za-z0-9_-]{43}|0[DEFG][A-Za-z0-9_-]{86})$"
            },
            "issuer": {
              "description": "Edge to a credential that establishes who the issuer is",
              "type": "object",
              "required": [
                "n",
                "s",
                "o"
              ],
              "properties": {
                "n": {
                  "description": "SAID of a credential that proves the issuer's identity",
                  "type": "string",
                  "pattern": "^(?:[BE][A-Za-z0-9_-]{43}|0[DEFG][A-Za-z0-9_-]{86})$"
                },
                "s": {
                  "description": "SAID of that credential's schema",
                  "type": "string",
                  "pattern": "^(?:[BE][A-Za-z0-9_-]{43}|0[DEFG][A-Za-z0-9_-]{86})$"
                },
                "o": {
                  "description": "Operator: the issuer AID of this ACDC MUST be the issuee AID of the node this edge points to",
                  "type": "string",
                  "const": "I2I"
                }
              },
              "additionalProperties": false
            },
            "coca": {
              "description": "Edge to the issuee's AI user code of conduct attestation",
              "type": "object",
              "required": [
                "n",
                "s"
              ],
              "properties": {
                "n": {
                  "description": "SAID of the code of conduct attestation",
                  "type": "string",
                  "pattern": "^(?:[BE][A-Za-z0-9_-]{43}|0[DEFG][A-Za-z0-9_-]{86})$"
                },
                "s": {
                  "description": "SAID of the ai-user-coca schema",
                  "type": "string",
                  "const": "EHReayB8hE1jqYEr418Hxh_najdMS8UExEG4G6Ris3MO"
                }
              },
              "additionalProperties": false
            }
          },
          "additionalProperties": false
        }
      ]
    },
    "r": {
      "oneOf": [
        {
          "description": "Rules section SAID (compact form)",
          "type": "string",
          "pattern": "^(?:[BE][A-Za-z0-9_-]{43}|0[DEFG][A-Za-z0-9_-]{86})$"
        },
        {
          "description": "Rules detail",
          "type": "object",
          "required": [
            "d",
            "licenseNotGuarantee",
            "namesAreConvenience",
            "privilegesEndAtTheHorizon"
          ],
          "properties": {
            "d": {
              "description": "SAID of this rules block",
              "type": "string",
              "pattern": "^(?:[BE][A-Za-z0-9_-]{43}|0[DEFG][A-Za-z0-9_-]{86})$"
            },
            "licenseNotGuarantee": {
              "description": "licenseNotGuarantee Disclaimer",
              "oneOf": [
                {
                  "description": "simple compact rule form",
                  "type": "string",
                  "const": "The issuer certifies that the issuee met its criteria at the time of issuance. It does not guarantee any particular code, review or outcome, and responsibility for what the issuee writes with an AI's help remains the issuee's."
                },
                {
                  "description": "Rule detail",
                  "type": "object",
                  "required": [
                    "l"
                  ],
                  "properties": {
                    "l": {
                      "description": "Associated legal language",
                      "type": "string",
                      "const": "The issuer certifies that the issuee met its criteria at the time of issuance. It does not guarantee any particular code, review or outcome, and responsibility for what the issuee writes with an AI's help remains the issuee's."
                    }
                  },
                  "additionalProperties": false
                }
              ]
            },
            "namesAreConvenience": {
              "description": "namesAreConvenience Disclaimer",
              "oneOf": [
                {
                  "description": "simple compact rule form",
                  "type": "string",
                  "const": "issuerName and issueeName are self-asserted conveniences for human readers and carry no verification weight. The parties to this credential are the AIDs, and a verifier that matches on a name rather than an AID has matched on nothing."
                },
                {
                  "description": "Rule detail",
                  "type": "object",
                  "required": [
                    "l"
                  ],
                  "properties": {
                    "l": {
                      "description": "Associated legal language",
                      "type": "string",
                      "const": "issuerName and issueeName are self-asserted conveniences for human readers and carry no verification weight. The parties to this credential are the AIDs, and a verifier that matches on a name rather than an AID has matched on nothing."
                    }
                  },
                  "additionalProperties": false
                }
              ]
            },
            "privilegesEndAtTheHorizon": {
              "description": "privilegesEndAtTheHorizon Disclaimer",
              "oneOf": [
                {
                  "description": "simple compact rule form",
                  "type": "string",
                  "const": "After validUntil the issuer stops managing revocation for this license, so an expired credential that has not been revoked is not thereby current. A verifier MUST treat the horizon as binding and MUST NOT infer continued standing from the absence of a revocation."
                },
                {
                  "description": "Rule detail",
                  "type": "object",
                  "required": [
                    "l"
                  ],
                  "properties": {
                    "l": {
                      "description": "Associated legal language",
                      "type": "string",
                      "const": "After validUntil the issuer stops managing revocation for this license, so an expired credential that has not been revoked is not thereby current. A verifier MUST treat the horizon as binding and MUST NOT infer continued standing from the absence of a revocation."
                    }
                  },
                  "additionalProperties": false
                }
              ]
            }
          },
          "additionalProperties": false
        }
      ]
    }
  },
  "additionalProperties": false
}
