{
  "v": "ACDCCAACAAJSONAAXe.",
  "t": "acm",
  "d": "ECfDWZPwbMuj6KBsyr6iSerjt0G_3uF97nhGW1cACxbm",
  "u": "0ACKoNoE_PbV-btx890IJlbf",
  "i": "EMRlhEQK44_V5804rsRvQ99Gtf7uDpYQqZuvrw0LhV3S",
  "rd": "EKfi58Jiv-NVqr6GOrxgxzhrE5RsDaH4QNwv9rCyZCwZ",
  "s": "ELIEUVwNAk1z-_jJJ9BuUtQw-c3TY-RvcQyYw5dI4_JK",
  "a": {
    "u": "0AAnyIk0ynz5Zy8Ikw0w4dld",
    "i": "EP4CmMn6ZTM3oTq-iI-2TQdlwdMXF6a2WFWaeQQRULsn",
    "dt": "2026-09-15T14:23:16.000000+00:00",
    "validFrom": "2026-09-15T14:23:16.000000+00:00",
    "issuerName": "Acme AI Certification Authority",
    "issueeName": "Alice Example"
  },
  "e": {
    "coca": {
      "n": "EBXbwk1trQqckUSiZfnnGxAGu10DC9nrIAvy7660jbfN",
      "s": "EHReayB8hE1jqYEr418Hxh_najdMS8UExEG4G6Ris3MO"
    }
  },
  "r": {
    "d": "EBZEbTHl6qaaMzPb5_cGIgXmGKDWMgQgCPZp4ivSxvt-",
    "licenseNotGuarantee": "The issuer certifies that the issuee met its criteria at the time of issuance. It does not guarantee any particular code, review or outcome, and responsibility for what the issuee writes with an AI's help remains the issuee's.",
    "namesAreConvenience": "issuerName and issueeName are self-asserted conveniences for human readers and carry no verification weight. The parties to this credential are the AIDs, and a verifier that matches on a name rather than an AID has matched on nothing.",
    "privilegesEndAtTheHorizon": "After validUntil the issuer stops managing revocation for this license, so an expired credential that has not been revoked is not thereby current. A verifier MUST treat the horizon as binding and MUST NOT infer continued standing from the absence of a revocation."
  }
}
